<?xml version="1.0" encoding="UTF-8"?>
<notes xmlns="https://bookml.org/ns/1.0"
       xmlns:xsi="http://www.w3.org/2001/XMLSchema-instance"
       xsi:schemaLocation="https://bookml.org/ns/1.0 ../schema/bookml-notes.xsd"
       bookml-version="1.0"
       chapter-id="ch04"
       book-id="carrier-to-yesterday"
       draft="1">

  <para-notes pid="CH04-P0010">
    <note id="CH04-P0010-N001" type="craft"
          author-type="ai" author="Openclaw"
          draft="1" created="2026-03-04T00:25:01+01:00">
      <body>
        Beat 1: Zoë reviews cryptic messages from Mateo, sensing a trap in his request for an urgent meeting. Plants continuity: maintains Zoë Kwan POV and advances the chapter title premise ("Robledo Recon") within Act I tone. Watch: keep consequences grounded in signal behaviour and human process, not mysticism.
      </body>
    </note>
  </para-notes>

  <para-notes pid="CH04-P0020">
    <note id="CH04-P0020-N001" type="craft"
          author-type="ai" author="Openclaw"
          draft="1" created="2026-03-04T00:25:01+01:00">
      <body>
        Beat 2: Zoë tries to get Mateo on board with her theory about Marina Ríos' murder. Plants continuity: maintains Zoë Kwan POV and advances the chapter title premise ("Robledo Recon") within Act I tone. Watch: keep consequences grounded in signal behaviour and human process, not mysticism.
      </body>
    </note>
  </para-notes>

  <para-notes pid="CH04-P0030">
    <note id="CH04-P0030-N001" type="craft"
          author-type="ai" author="Openclaw"
          draft="1" created="2026-03-04T00:25:01+01:00">
      <body>
        Beat 3: Zoë frantically searches for any mention of Dr. Baeza's research online. Plants continuity: maintains Zoë Kwan POV and advances the chapter title premise ("Robledo Recon") within Act I tone. Watch: keep consequences grounded in signal behaviour and human process, not mysticism.
      </body>
    </note>
  </para-notes>

  <para-notes pid="CH04-P0040">
    <note id="CH04-P0040-N001" type="craft"
          author-type="ai" author="Openclaw"
          draft="1" created="2026-03-04T00:25:01+01:00">
      <body>
        Beat 4: Zoë tries to shake off the feeling of being watched while hacking into Robledo's security system. Plants continuity: maintains Zoë Kwan POV and advances the chapter title premise ("Robledo Recon") within Act I tone. Watch: keep consequences grounded in signal behaviour and human process, not mysticism.
      </body>
    </note>
  </para-notes>

  <para-notes pid="CH04-P0050">
    <note id="CH04-P0050-N001" type="craft"
          author-type="ai" author="Openclaw"
          draft="1" created="2026-03-04T00:25:01+01:00">
      <body>
        Beat 5: Zoë discovers Mateo's hidden research on Robledo's biometric data, fuelling her growing suspicion. Plants continuity: maintains Zoë Kwan POV and advances the chapter title premise ("Robledo Recon") within Act I tone. Watch: keep consequences grounded in signal behaviour and human process, not mysticism.
      </body>
    </note>
  </para-notes>

  <para-notes pid="CH04-P0060">
    <note id="CH04-P0060-N001" type="craft"
          author-type="ai" author="Openclaw"
          draft="1" created="2026-03-04T00:25:01+01:00">
      <body>
        Beat 6: Zoë confronts Mateo about the inconsistencies in Dr. Baeza's research, sensing a hidden agenda. Plants continuity: maintains Zoë Kwan POV and advances the chapter title premise ("Robledo Recon") within Act I tone. Watch: keep consequences grounded in signal behaviour and human process, not mysticism.
      </body>
    </note>
  </para-notes>

  <para-notes pid="CH04-P0070">
    <note id="CH04-P0070-N001" type="craft"
          author-type="ai" author="Openclaw"
          draft="1" created="2026-03-04T00:25:01+01:00">
      <body>
        Beat 7: Zoë confronts Mateo about the inconsistencies in Dr. Baeza's research, sensing a hidden agenda. Plants continuity: maintains Zoë Kwan POV and advances the chapter title premise ("Robledo Recon") within Act I tone. Watch: keep consequences grounded in signal behaviour and human process, not mysticism.
      </body>
    </note>
  </para-notes>

  <para-notes pid="CH04-P0080">
    <note id="CH04-P0080-N001" type="craft"
          author-type="ai" author="Openclaw"
          draft="1" created="2026-03-04T00:25:01+01:00">
      <body>
        Beat 8: Zoë discovers a cryptic message on Mateo's computer, hinting at an imminent catastrophe. Plants continuity: maintains Zoë Kwan POV and advances the chapter title premise ("Robledo Recon") within Act I tone. Watch: keep consequences grounded in signal behaviour and human process, not mysticism.
      </body>
    </note>
  </para-notes>

  <para-notes pid="CH04-P0090">
    <note id="CH04-P0090-N001" type="craft"
          author-type="ai" author="Openclaw"
          draft="1" created="2026-03-04T00:25:01+01:00">
      <body>
        Beat 9: Zoë discovers Mateo's secret research on Dr. Baeza's encrypted files. Plants continuity: maintains Zoë Kwan POV and advances the chapter title premise ("Robledo Recon") within Act I tone. Watch: keep consequences grounded in signal behaviour and human process, not mysticism.
      </body>
    </note>
  </para-notes>

  <para-notes pid="CH04-P0100">
    <note id="CH04-P0100-N001" type="craft"
          author-type="ai" author="Openclaw"
          draft="1" created="2026-03-04T00:25:01+01:00">
      <body>
        Beat 10: Zoë and Mateo analyze the cryptic message from Dr. Baeza, their theories diverging. Plants continuity: maintains Zoë Kwan POV and advances the chapter title premise ("Robledo Recon") within Act I tone. Watch: keep consequences grounded in signal behaviour and human process, not mysticism.
      </body>
    </note>
  </para-notes>

  <para-notes pid="CH04-P0110">
    <note id="CH04-P0110-N001" type="craft"
          author-type="ai" author="Openclaw"
          draft="1" created="2026-03-04T00:25:01+01:00">
      <body>
        Beat 11: Zoë confronts Mateo about his suspicious behavior and possible involvement in the lab sabotage. Plants continuity: maintains Zoë Kwan POV and advances the chapter title premise ("Robledo Recon") within Act I tone. Watch: keep consequences grounded in signal behaviour and human process, not mysticism.
      </body>
    </note>
  </para-notes>

  <para-notes pid="CH04-P0120">
    <note id="CH04-P0120-N001" type="craft"
          author-type="ai" author="Openclaw"
          draft="1" created="2026-03-04T00:25:01+01:00">
      <body>
        Beat 12: Zoë tries to piece together the evidence, but inconsistencies nag her. Plants continuity: maintains Zoë Kwan POV and advances the chapter title premise ("Robledo Recon") within Act I tone. Watch: keep consequences grounded in signal behaviour and human process, not mysticism.
      </body>
    </note>
  </para-notes>

  <para-notes pid="CH04-P0130">
    <note id="CH04-P0130-N001" type="craft"
          author-type="ai" author="Openclaw"
          draft="1" created="2026-03-04T00:25:01+01:00">
      <body>
        Beat 13: Zoë discovers Mateo's hidden research on Dr. Baeza's project Plants continuity: maintains Zoë Kwan POV and advances the chapter title premise ("Robledo Recon") within Act I tone. Watch: keep consequences grounded in signal behaviour and human process, not mysticism.
      </body>
    </note>
  </para-notes>

  <para-notes pid="CH04-P0140">
    <note id="CH04-P0140-N001" type="craft"
          author-type="ai" author="Openclaw"
          draft="1" created="2026-03-04T00:25:01+01:00">
      <body>
        Beat 14: Zoë discovers Mateo's hidden research on Dr. Baeza's project, sparking a growing sense of dread. Plants continuity: maintains Zoë Kwan POV and advances the chapter title premise ("Robledo Recon") within Act I tone. Watch: keep consequences grounded in signal behaviour and human process, not mysticism.
      </body>
    </note>
  </para-notes>

  <para-notes pid="CH04-P0150">
    <note id="CH04-P0150-N001" type="craft"
          author-type="ai" author="Openclaw"
          draft="1" created="2026-03-04T00:25:01+01:00">
      <body>
        Beat 15: Zoë's research yields a disturbing connection between the murders and an obscure neuroscience paper. Plants continuity: maintains Zoë Kwan POV and advances the chapter title premise ("Robledo Recon") within Act I tone. Watch: keep consequences grounded in signal behaviour and human process, not mysticism.
      </body>
    </note>
  </para-notes>

</notes>
