<?xml version="1.0" encoding="UTF-8"?>
<notes xmlns="https://bookml.org/ns/1.0"
       xmlns:xsi="http://www.w3.org/2001/XMLSchema-instance"
       xsi:schemaLocation="https://bookml.org/ns/1.0 ../schema/bookml-notes.xsd"
       bookml-version="1.0"
       chapter-id="ch08"
       book-id="carrier-to-yesterday"
       draft="1">

  <para-notes pid="CH08-P0010">
    <note id="CH08-P0010-N001" type="craft"
          author-type="ai" author="Openclaw"
          draft="1" created="2026-03-04T19:23:38+01:00">
      <body>
        Beat 1: Zoë's late-night coding session is disrupted by an unsettling, anonymous message. Plants continuity: maintains Zoë Kwan POV and advances the chapter title premise ("Signal-to-Noise") within Act II tone. Watch: keep consequences grounded in signal behaviour and human process, not mysticism.
      </body>
    </note>
  </para-notes>

  <para-notes pid="CH08-P0020">
    <note id="CH08-P0020-N001" type="craft"
          author-type="ai" author="Openclaw"
          draft="1" created="2026-03-04T19:23:38+01:00">
      <body>
        Beat 2: Zoë frantically searches for a noise-cancelling headset to block out the eerie silence. Plants continuity: maintains Zoë Kwan POV and advances the chapter title premise ("Signal-to-Noise") within Act II tone. Watch: keep consequences grounded in signal behaviour and human process, not mysticism.
      </body>
    </note>
  </para-notes>

  <para-notes pid="CH08-P0030">
    <note id="CH08-P0030-N001" type="craft"
          author-type="ai" author="Openclaw"
          draft="1" created="2026-03-04T19:23:38+01:00">
      <body>
        Beat 3: Zoë discovers Mateo's hidden research on the lottery's statistical anomalies. Plants continuity: maintains Zoë Kwan POV and advances the chapter title premise ("Signal-to-Noise") within Act II tone. Watch: keep consequences grounded in signal behaviour and human process, not mysticism.
      </body>
    </note>
  </para-notes>

  <para-notes pid="CH08-P0040">
    <note id="CH08-P0040-N001" type="craft"
          author-type="ai" author="Openclaw"
          draft="1" created="2026-03-04T19:23:38+01:00">
      <body>
        Beat 4: Zoë ponders Mateo's cryptic message as she tries to focus on her work. Plants continuity: maintains Zoë Kwan POV and advances the chapter title premise ("Signal-to-Noise") within Act II tone. Watch: keep consequences grounded in signal behaviour and human process, not mysticism.
      </body>
    </note>
  </para-notes>

  <para-notes pid="CH08-P0050">
    <note id="CH08-P0050-N001" type="craft"
          author-type="ai" author="Openclaw"
          draft="1" created="2026-03-04T19:23:38+01:00">
      <body>
        Beat 5: Zoë frantically searches for a hidden tracking device in her belongings. Plants continuity: maintains Zoë Kwan POV and advances the chapter title premise ("Signal-to-Noise") within Act II tone. Watch: keep consequences grounded in signal behaviour and human process, not mysticism.
      </body>
    </note>
  </para-notes>

  <para-notes pid="CH08-P0060">
    <note id="CH08-P0060-N001" type="craft"
          author-type="ai" author="Openclaw"
          draft="1" created="2026-03-04T19:23:38+01:00">
      <body>
        Beat 6: Mateo's cryptic message sparks Zoë's investigation into Dr. Baeza's research. Plants continuity: maintains Zoë Kwan POV and advances the chapter title premise ("Signal-to-Noise") within Act II tone. Watch: keep consequences grounded in signal behaviour and human process, not mysticism.
      </body>
    </note>
  </para-notes>

  <para-notes pid="CH08-P0070">
    <note id="CH08-P0070-N001" type="craft"
          author-type="ai" author="Openclaw"
          draft="1" created="2026-03-04T19:23:38+01:00">
      <body>
        Beat 7: Zoë discovers Mateo's cryptic notes on the lottery algorithm and its unsettling connection to Dr. Baeza's research. Plants continuity: maintains Zoë Kwan POV and advances the chapter title premise ("Signal-to-Noise") within Act II tone. Watch: keep consequences grounded in signal behaviour and human process, not mysticism.
      </body>
    </note>
  </para-notes>

  <para-notes pid="CH08-P0080">
    <note id="CH08-P0080-N001" type="craft"
          author-type="ai" author="Openclaw"
          draft="1" created="2026-03-04T19:23:38+01:00">
      <body>
        Beat 8: Zoë discovers Mateo's hidden server, sparking a desperate search for answers Plants continuity: maintains Zoë Kwan POV and advances the chapter title premise ("Signal-to-Noise") within Act II tone. Watch: keep consequences grounded in signal behaviour and human process, not mysticism.
      </body>
    </note>
  </para-notes>

  <para-notes pid="CH08-P0090">
    <note id="CH08-P0090-N001" type="craft"
          author-type="ai" author="Openclaw"
          draft="1" created="2026-03-04T19:23:38+01:00">
      <body>
        Beat 9: Zoë discovers a suspicious discrepancy in the lottery algorithm's code. Plants continuity: maintains Zoë Kwan POV and advances the chapter title premise ("Signal-to-Noise") within Act II tone. Watch: keep consequences grounded in signal behaviour and human process, not mysticism.
      </body>
    </note>
  </para-notes>

  <para-notes pid="CH08-P0100">
    <note id="CH08-P0100-N001" type="craft"
          author-type="ai" author="Openclaw"
          draft="1" created="2026-03-04T19:23:38+01:00">
      <body>
        Beat 10: Zoë discovers a cryptic message on Mateo's computer, hinting at an imminent catastrophe. Plants continuity: maintains Zoë Kwan POV and advances the chapter title premise ("Signal-to-Noise") within Act II tone. Watch: keep consequences grounded in signal behaviour and human process, not mysticism.
      </body>
    </note>
  </para-notes>

  <para-notes pid="CH08-P0110">
    <note id="CH08-P0110-N001" type="craft"
          author-type="ai" author="Openclaw"
          draft="1" created="2026-03-04T19:23:38+01:00">
      <body>
        Beat 11: Zoë discovers a disturbing pattern in the lottery data, hinting at an unknown force manipulating the outcomes. Plants continuity: maintains Zoë Kwan POV and advances the chapter title premise ("Signal-to-Noise") within Act II tone. Watch: keep consequences grounded in signal behaviour and human process, not mysticism.
      </body>
    </note>
  </para-notes>

  <para-notes pid="CH08-P0120">
    <note id="CH08-P0120-N001" type="craft"
          author-type="ai" author="Openclaw"
          draft="1" created="2026-03-04T19:23:38+01:00">
      <body>
        Beat 12: Zoë discovers Mateo's hidden server, sparking a desperate search for answers Plants continuity: maintains Zoë Kwan POV and advances the chapter title premise ("Signal-to-Noise") within Act II tone. Watch: keep consequences grounded in signal behaviour and human process, not mysticism.
      </body>
    </note>
  </para-notes>

  <para-notes pid="CH08-P0130">
    <note id="CH08-P0130-N001" type="craft"
          author-type="ai" author="Openclaw"
          draft="1" created="2026-03-04T19:23:38+01:00">
      <body>
        Beat 13: Zoë confronts Mateo about Marina's cryptic message and the eerie silence from Dr. Baeza. Plants continuity: maintains Zoë Kwan POV and advances the chapter title premise ("Signal-to-Noise") within Act II tone. Watch: keep consequences grounded in signal behaviour and human process, not mysticism.
      </body>
    </note>
  </para-notes>

  <para-notes pid="CH08-P0140">
    <note id="CH08-P0140-N001" type="craft"
          author-type="ai" author="Openclaw"
          draft="1" created="2026-03-04T19:23:38+01:00">
      <body>
        Beat 14: Mateo's lottery code analysis sparks a disturbing connection to Dr. Baeza's research. Plants continuity: maintains Zoë Kwan POV and advances the chapter title premise ("Signal-to-Noise") within Act II tone. Watch: keep consequences grounded in signal behaviour and human process, not mysticism.
      </body>
    </note>
  </para-notes>

  <para-notes pid="CH08-P0150">
    <note id="CH08-P0150-N001" type="craft"
          author-type="ai" author="Openclaw"
          draft="1" created="2026-03-04T19:23:38+01:00">
      <body>
        Beat 15: Zoë realizes Mateo's lottery wins are linked to the anomalies. Plants continuity: maintains Zoë Kwan POV and advances the chapter title premise ("Signal-to-Noise") within Act II tone. Watch: keep consequences grounded in signal behaviour and human process, not mysticism.
      </body>
    </note>
  </para-notes>

</notes>
