<?xml version="1.0" encoding="UTF-8"?>
<notes xmlns="https://bookml.org/ns/1.0"
       xmlns:xsi="http://www.w3.org/2001/XMLSchema-instance"
       xsi:schemaLocation="https://bookml.org/ns/1.0 ../schema/bookml-notes.xsd"
       bookml-version="1.0"
       chapter-id="ch05"
       book-id="carrier-to-yesterday"
       draft="1">

  <para-notes pid="CH05-P0010">
    <note id="CH05-P0010-N001" type="craft"
          author-type="ai" author="Openclaw"
          draft="1" created="2026-03-04T05:20:04+01:00">
      <body>
        Beat 1: Mateo wakes up to an unusual dream and can't shake the feeling it's more than just a dream Plants continuity: maintains Mateo Salas POV and advances the chapter title premise ("The First Bounce") within Act I tone. Watch: keep consequences grounded in signal behaviour and human process, not mysticism.
      </body>
    </note>
  </para-notes>

  <para-notes pid="CH05-P0020">
    <note id="CH05-P0020-N001" type="craft"
          author-type="ai" author="Openclaw"
          draft="1" created="2026-03-04T05:20:04+01:00">
      <body>
        Beat 2: Mateo starts experiencing strange, unexplainable glitches on his computer and phone Plants continuity: maintains Mateo Salas POV and advances the chapter title premise ("The First Bounce") within Act I tone. Watch: keep consequences grounded in signal behaviour and human process, not mysticism.
      </body>
    </note>
  </para-notes>

  <para-notes pid="CH05-P0030">
    <note id="CH05-P0030-N001" type="craft"
          author-type="ai" author="Openclaw"
          draft="1" created="2026-03-04T05:20:04+01:00">
      <body>
        Beat 3: Mateo arrives at the lab to find Dr. Baeza working on a new experiment Plants continuity: maintains Mateo Salas POV and advances the chapter title premise ("The First Bounce") within Act I tone. Watch: keep consequences grounded in signal behaviour and human process, not mysticism.
      </body>
    </note>
  </para-notes>

  <para-notes pid="CH05-P0040">
    <note id="CH05-P0040-N001" type="craft"
          author-type="ai" author="Openclaw"
          draft="1" created="2026-03-04T05:20:04+01:00">
      <body>
        Beat 4: Mateo asks Dr. Baeza about her project and she's hesitant to share details Plants continuity: maintains Mateo Salas POV and advances the chapter title premise ("The First Bounce") within Act I tone. Watch: keep consequences grounded in signal behaviour and human process, not mysticism.
      </body>
    </note>
  </para-notes>

  <para-notes pid="CH05-P0050">
    <note id="CH05-P0050-N001" type="craft"
          author-type="ai" author="Openclaw"
          draft="1" created="2026-03-04T05:20:04+01:00">
      <body>
        Beat 5: Javi teases Mateo about his lack of technical knowledge Plants continuity: maintains Mateo Salas POV and advances the chapter title premise ("The First Bounce") within Act I tone. Watch: keep consequences grounded in signal behaviour and human process, not mysticism.
      </body>
    </note>
  </para-notes>

  <para-notes pid="CH05-P0060">
    <note id="CH05-P0060-N001" type="craft"
          author-type="ai" author="Openclaw"
          draft="1" created="2026-03-04T05:20:04+01:00">
      <body>
        Beat 6: Chief Ortega arrives, asking about the project's progress and potential risks Plants continuity: maintains Mateo Salas POV and advances the chapter title premise ("The First Bounce") within Act I tone. Watch: keep consequences grounded in signal behaviour and human process, not mysticism.
      </body>
    </note>
  </para-notes>

  <para-notes pid="CH05-P0070">
    <note id="CH05-P0070-N001" type="craft"
          author-type="ai" author="Openclaw"
          draft="1" created="2026-03-04T05:20:04+01:00">
      <body>
        Beat 7: Mateo starts experiencing more glitches and strange occurrences at home Plants continuity: maintains Mateo Salas POV and advances the chapter title premise ("The First Bounce") within Act I tone. Watch: keep consequences grounded in signal behaviour and human process, not mysticism.
      </body>
    </note>
  </para-notes>

  <para-notes pid="CH05-P0080">
    <note id="CH05-P0080-N001" type="craft"
          author-type="ai" author="Openclaw"
          draft="1" created="2026-03-04T05:20:04+01:00">
      <body>
        Beat 8: Mateo tries to troubleshoot the issues but can't find a logical explanation Plants continuity: maintains Mateo Salas POV and advances the chapter title premise ("The First Bounce") within Act I tone. Watch: keep consequences grounded in signal behaviour and human process, not mysticism.
      </body>
    </note>
  </para-notes>

  <para-notes pid="CH05-P0090">
    <note id="CH05-P0090-N001" type="craft"
          author-type="ai" author="Openclaw"
          draft="1" created="2026-03-04T05:20:04+01:00">
      <body>
        Beat 9: Mateo confides in Zoë about his experiences and she offers to help him investigate Plants continuity: maintains Mateo Salas POV and advances the chapter title premise ("The First Bounce") within Act I tone. Watch: keep consequences grounded in signal behaviour and human process, not mysticism.
      </body>
    </note>
  </para-notes>

  <para-notes pid="CH05-P0100">
    <note id="CH05-P0100-N001" type="craft"
          author-type="ai" author="Openclaw"
          draft="1" created="2026-03-04T05:20:04+01:00">
      <body>
        Beat 10: Mateo and Zoë start digging into the lab's experiments and possible connections to Mateo's glitches Plants continuity: maintains Mateo Salas POV and advances the chapter title premise ("The First Bounce") within Act I tone. Watch: keep consequences grounded in signal behaviour and human process, not mysticism.
      </body>
    </note>
  </para-notes>

  <para-notes pid="CH05-P0110">
    <note id="CH05-P0110-N001" type="craft"
          author-type="ai" author="Openclaw"
          draft="1" created="2026-03-04T05:20:04+01:00">
      <body>
        Beat 11: Dr. Baeza warns them about the risks of meddling with her project Plants continuity: maintains Mateo Salas POV and advances the chapter title premise ("The First Bounce") within Act I tone. Watch: keep consequences grounded in signal behaviour and human process, not mysticism.
      </body>
    </note>
  </para-notes>

  <para-notes pid="CH05-P0120">
    <note id="CH05-P0120-N001" type="craft"
          author-type="ai" author="Openclaw"
          draft="1" created="2026-03-04T05:20:04+01:00">
      <body>
        Beat 12: Mateo and Zoë meet with Marina to discuss their findings and potential consequences Plants continuity: maintains Mateo Salas POV and advances the chapter title premise ("The First Bounce") within Act I tone. Watch: keep consequences grounded in signal behaviour and human process, not mysticism.
      </body>
    </note>
  </para-notes>

  <para-notes pid="CH05-P0130">
    <note id="CH05-P0130-N001" type="craft"
          author-type="ai" author="Openclaw"
          draft="1" created="2026-03-04T05:20:04+01:00">
      <body>
        Beat 13: Mateo starts experiencing more intense, disturbing glitches and visions Plants continuity: maintains Mateo Salas POV and advances the chapter title premise ("The First Bounce") within Act I tone. Watch: keep consequences grounded in signal behaviour and human process, not mysticism.
      </body>
    </note>
  </para-notes>

  <para-notes pid="CH05-P0140">
    <note id="CH05-P0140-N001" type="craft"
          author-type="ai" author="Openclaw"
          draft="1" created="2026-03-04T05:20:04+01:00">
      <body>
        Beat 14: Mateo realizes he needs to take drastic action to stop the anomalies Plants continuity: maintains Mateo Salas POV and advances the chapter title premise ("The First Bounce") within Act I tone. Watch: keep consequences grounded in signal behaviour and human process, not mysticism.
      </body>
    </note>
  </para-notes>

</notes>
